{"catalogVersion":9,"correlationId":"727de404-f64a-4232-8cb2-338684bf4051","definitionRevision":"sha256:1ae595251efc58d4b489851679f45458f2eb0c1d4b29c548bc24b7969a711608","elapsedTimeMs":1128,"kernelVersion":"1.0.0-SNAPSHOT","mode":"ACCEPTED_BASELINE","schemaVersion":1,"schoolId":"merivalja-kool","status":"VERIFIED","timetableRevision":"sha256:dd4f9c06b2c75f2e8736e0a02a94986c85f4c8206cb159fbe870baba000ea86d"}