{"catalogVersion":9,"correlationId":"6267e6ad-8eb8-4487-b7c9-478c524ee7c1","definitionRevision":"sha256:6617119fd1e12a16d3a2835dd6694d2a1aaeb7a323f44fff5700a96fee86ec31","elapsedTimeMs":445,"kernelVersion":"1.0.0-SNAPSHOT","mode":"ACCEPTED_BASELINE","schemaVersion":1,"schoolId":"demo-school","status":"VERIFIED","timetableRevision":"sha256:c74b60955c233072e82d3bbc673f1b56db7e8d9b5014ec810ee77a9f6942134d"}