{"catalogVersion":9,"correlationId":"d6a39c8d-f0e1-47aa-bb26-6c5f7179e0d7","definitionRevision":"sha256:ff55b09880c66dae6b7d18fdc2cc715bc74ea0821dfbb2d6e61a75cf47e7e4e6","elapsedTimeMs":656,"kernelVersion":"1.0.0-SNAPSHOT","mode":"INITIAL_DEFINITION","schemaVersion":1,"schoolId":"fictional-qualification-72","status":"VERIFIED"}